{
  "deploymentVersion": 1,
  "contractFingerprint": "8c97ebcf242bc16a3485bb88a34c2786e9f633a18d43a834338919bf5b0fb681",
  "providers": [{
    "id": "vehicle_network",
    "profile": "vsomeip",
    "required": true,
    "extensions": {
      "org.openvehicleframework.vsomeip": {
        "application": "ovf-radar",
        "applicationId": 4933,
        "routing": "ovf-radar",
        "reliablePort": 30509
      }
    }
  }],
  "instances": [{
    "serviceId": "42bd2fc5-8f32-4e57-8a33-94fb0a5cf71d",
    "instanceId": "c1813c19-1f06-4914-bb0d-c6080f1a846a",
    "alias": "front-radar",
    "routes": [{
      "provider": "vehicle_network",
      "role": "consumer",
      "required": true,
      "priority": 0,
      "requiredFeatures": ["discovery", "events", "methods", "reliable", "ordered", "deadlines", "cancellation"],
      "limits": {
        "maxPayloadSize": 65536,
        "maxHistoryDepth": 1,
        "maxOutstandingOperations": 16,
        "maxEndpoints": 8
      },
      "mappings": {
        "service": 4660,
        "instance": 1,
        "elements": {
          "851b0fc7-d41f-4e4f-9673-4be1aeed6f62": {
            "id": 32769, "eventGroup": 1, "major": 1, "minor": 0,
            "kind": "event", "reliable": true
          },
          "89dfe84f-1ab7-416d-891c-f603bc1f4557": {
            "id": 1, "eventGroup": 0, "major": 1, "minor": 0,
            "kind": "method", "reliable": true
          },
          "aac81bc6-8197-4b52-887c-c918630cbd2d": {
            "get": {
              "id": 2, "eventGroup": 0, "major": 1, "minor": 0,
              "kind": "fieldGet", "reliable": true
            },
            "notify": {
              "id": 32770, "eventGroup": 2, "major": 1, "minor": 0,
              "kind": "fieldNotify", "reliable": true
            }
          }
        }
      }
    }]
  }]
}
