{
  "deploymentVersion": 1,
  "contractFingerprint": "8c97ebcf242bc16a3485bb88a34c2786e9f633a18d43a834338919bf5b0fb681",
  "providers": [{"id": "shared_memory", "profile": "iceoryx2", "required": true}],
  "instances": [{
    "serviceId": "42bd2fc5-8f32-4e57-8a33-94fb0a5cf71d",
    "instanceId": "c1813c19-1f06-4914-bb0d-c6080f1a846a",
    "alias": "front-radar",
    "routes": [{
      "provider": "shared_memory", "role": "consumer", "required": true, "priority": 0,
      "requiredFeatures": ["discovery", "events", "methods", "loans", "scatterGather", "reliable", "ordered", "deadlines", "cancellation"],
      "limits": {"maxPayloadSize": 4096, "maxHistoryDepth": 1, "maxOutstandingOperations": 16, "maxEndpoints": 8},
      "mappings": {
        "service": "vehicle/radar", "instance": "front",
        "elements": {
          "851b0fc7-d41f-4e4f-9673-4be1aeed6f62": {
            "name": "objects", "type": "RadarFrame", "payloadSize": 4096,
            "alignment": 8, "history": 1, "subscriberBuffer": 8,
            "maxPublishers": 2, "maxSubscribers": 8, "safeOverflow": false
          },
          "89dfe84f-1ab7-416d-891c-f603bc1f4557": {
            "name": "calibrate", "requestType": "CalibrateInput",
            "responseType": "CalibrateResult", "requestPayloadSize": 4096,
            "responsePayloadSize": 4096, "alignment": 8, "requestBuffer": 16,
            "responseBuffer": 8, "maxClients": 8, "maxServers": 1, "safeOverflow": false
          },
          "aac81bc6-8197-4b52-887c-c918630cbd2d": {
            "get": {
              "name": "vehicle-state-get", "requestType": "Empty",
              "responseType": "VehicleState", "requestPayloadSize": 4096,
              "responsePayloadSize": 4096, "alignment": 8, "requestBuffer": 16,
              "responseBuffer": 8, "maxClients": 8, "maxServers": 1, "safeOverflow": false
            },
            "notify": {
              "name": "vehicle-state", "type": "VehicleState", "payloadSize": 4096,
              "alignment": 8, "history": 1, "subscriberBuffer": 8,
              "maxPublishers": 2, "maxSubscribers": 8, "safeOverflow": false
            }
          }
        }
      }
    }]
  }]
}
